<?xml version="1.0" encoding="utf-8"?>
<!DOCTYPE Annotation PUBLIC "-//GENIA//DTD GENIA ANNOTATION EVENT 2.0//EN" "../GENIAtypes/GENIA_event_20.dtd">
<Annotation created="20/11/2006" annotates="http://www.ncbi.nlm.nih.gov/entrez/eutils/efetch.fcgi?db=pubmed&amp;retmode=xml&amp;rettype=medline&amp;id=8692924" creator="Junko Matsuura">
<PubmedArticleSet>
<PubmedArticle>
<MedlineCitation>
<PMID>8692924</PMID>
<Article>
<ArticleTitle>
<sentence id="S1"><term sem="Protein_molecule" id="T1" lex="BCL-6">BCL-6</term>, a <term sem="Protein_family_or_group" id="T2" lex="POZ/zinc-finger_protein">POZ/zinc-finger protein</term>, is a <term sem="Protein_family_or_group" id="T3" lex="sequence-specific_transcriptional_repressor">sequence-specific transcriptional repressor</term>.</sentence>
</ArticleTitle>
<Abstract>
<AbstractText>
<sentence id="S2">Approximately 40% of <term sem="Other" id="T4" lex="diffuse_large_cell_lymphoma">diffuse large cell lymphoma</term> are associated with <term sem="Other" id="T5" lex="chromosomal_translocation">chromosomal translocations</term> that deregulate the expression of the <term sem="DNA_domain_or_region" id="T6" lex="BCL6_gene">BCL6 gene</term> by juxtaposing <term sem="DNA_domain_or_region" id="T7" lex="heterologous_promoter">heterologous promoters</term> to the <term sem="DNA_domain_or_region" id="T8" lex="BCL-6_coding_domain"><term sem="Protein_molecule" id="T9" lex="BCL-6">BCL-6</term> coding domain</term>.</sentence>
<event id="E1">
<type class="Correlation" />
<theme idref="T4" />
<theme idref="T5" />
<clue>Approximately 40% of diffuse large cell lymphoma are <clueType>associated</clueType> <linkTheme>with</linkTheme> chromosomal translocations that deregulate the expression of the BCL6 gene by juxtaposing heterologous promoters to the BCL-6 coding domain.</clue>
</event>
<event id="E2">
<type class="Gene_expression" />
<theme idref="T6" />
<clue>Approximately 40% of diffuse large cell lymphoma are associated with chromosomal translocations that deregulate the <clueType>expression</clueType> <linkTheme>of</linkTheme> the BCL6 gene by juxtaposing heterologous promoters to the BCL-6 coding domain.</clue>
</event>
<event assertion="non-exist" id="E3">
<type class="Regulation" />
<theme idref="E2" />
<cause idref="T5" />
<clue>Approximately 40% of diffuse large cell lymphoma are associated with chromosomal translocations that <clueType>deregulate</clueType> the expression of the BCL6 gene by juxtaposing heterologous promoters to the BCL-6 coding domain.</clue>
</event>
<sentence id="S3">The <term sem="DNA_domain_or_region" id="T10" lex="BCL6_gene">BCL6 gene</term> encodes a <term sem="Protein_molecule" id="T11" lex="95-kDa_protein">95-kDa protein</term> containing six <term sem="Protein_substructure" id="T12" lex="C-terminal_zinc-finger_motif">C-terminal zinc-finger motifs</term> and an <term sem="Protein_domain_or_region" id="T13" lex="N-terminal_POZ_domain">N-terminal POZ domain</term>, suggesting that it may function as a <term sem="Protein_family_or_group" id="T14" lex="transcription_factor">transcription factor</term>.</sentence>
<sentence id="S4">By using a <term sem="DNA_domain_or_region" id="T15" lex="DNA_sequence">DNA sequence</term> selected for its ability to bind <term sem="Protein_molecule" id="T16" lex="recombinant_BCL-6">recombinant <term sem="Protein_molecule" id="T17" lex="BCL-6">BCL-6</term></term> in vitro, we show here that <term sem="Protein_molecule" id="T18" lex="BCL-6">BCL-6</term> is present in <term sem="Protein_complex" id="T19" lex="DNA-binding_complex">DNA-binding complexes</term> in <term sem="Cell_component" id="T20" lex="nuclear_extract">nuclear extracts</term> from various <term sem="Cell_cultured" id="T21" lex="B-cell_line">B-cell lines</term>.</sentence>
<sentence id="S5">In transient transfectin experiments, <term sem="Protein_molecule" id="T22" lex="BCL6">BCL6</term> can repress <term sem="Other" id="A4">transcription</term> from <term sem="DNA_family_or_group" id="T23" lex="promoter">promoters</term> linked to its <term sem="DNA_domain_or_region" id="T24" lex="DNA_target_sequence">DNA target sequence</term> and this activity is dependent upon specific <term sem="Other" id="T25" lex="DNA-binding">DNA-binding</term> and the presence of an intact <term sem="Protein_domain_or_region" id="T26" lex="N-terminal_half">N-terminal half</term> of the protein.</sentence>
<event id="E4">
<type class="Positive_regulation" />
<theme idref="A4" />
<cause idref="T23" />
<clue>In transient transfectin experiments, BCL6 can repress transcription <linkCause>from</linkCause> promoters linked to its DNA target sequence and this activity is dependent upon specific DNA-binding and the presence of an intact N-terminal half of the protein.</clue>
<comment>NO CLUETYPE</comment>
</event>
<event id="E5">
<type class="Negative_regulation" />
<theme idref="E4" />
<cause idref="T22" />
<clue>In transient transfectin experiments, BCL6 can <clueType>repress</clueType> transcription from promoters linked to its DNA target sequence and this activity is dependent upon specific DNA-binding and the presence of an intact N-terminal half of the protein.</clue>
</event>
<event id="E6">
<type class="Positive_regulation" />
<theme idref="E5" />
<cause idref="T25" />
<clue>In transient transfectin experiments, BCL6 can repress transcription from promoters linked to its DNA target sequence and <corefTheme>this activity</corefTheme> is <clueType>dependent</clueType> <linkCause>upon</linkCause> specific DNA-binding and the presence of an intact N-terminal half of the protein.</clue>
</event>
<event id="E7">
<type class="Positive_regulation" />
<theme idref="E5" />
<cause idref="T26" />
<clue>In transient transfectin experiments, BCL6 can repress transcription from promoters linked to its DNA target sequence and <corefTheme>this activity</corefTheme> is <clueType>dependent</clueType> <linkCause>upon</linkCause> specific DNA-binding and the presence of an intact N-terminal half of the protein.</clue>
</event>
<sentence id="S6">We demonstrate that this part of the <term sem="Protein_molecule" id="T27" lex="BCL6_molecule"><term sem="Protein_molecule" id="T28" lex="BCL6">BCL6</term> molecule</term> contains an <term sem="Protein_domain_or_region" id="T29" lex="autonomous_transrepressor_domain">autonomous transrepressor domain</term> and that two <term sem="Protein_domain_or_region" id="T30" lex="noncontiguous_regions">noncontiguous regions</term>, including the <term sem="Protein_substructure" id="T31" lex="POZ_motif">POZ motif</term>, mediate maximum <term sem="Other" id="T32" lex="transrepressive_activity">transrepressive activity</term>.</sentence>
<event id="E8">
<type class="Positive_regulation" />
<theme idref="T32" />
<cause idref="T30" />
<clue>We demonstrate that this part of the BCL6 molecule contains an autonomous transrepressor domain and that two noncontiguous regions, including the POZ motif, <clueType>mediate</clueType> maximum transrepressive activity.</clue>
</event>
<sentence id="S7">These results indicate that the <term sem="Protein_molecule" id="T33" lex="BCL-6_protein"><term sem="Protein_molecule" id="T34" lex="BCL-6">BCL-6</term> protein</term> can function as a <term sem="Protein_family_or_group" id="T35" lex="sequence-specific_transcriptional_repressor">sequence-specific transcriptional repressor</term> and have implications for the role of <term sem="Protein_molecule" id="T36" lex="BCL6">BCL6</term> in <term sem="Other" id="T37" lex="normal_lymphoid_development">normal <term sem="Cell_natural" id="A3">lymphoid</term> development</term> and <term sem="Other" id="T38" lex="lymphomagenesis">lymphomagenesis</term>.</sentence>
<event id="E9">
<type class="Cellular_physiological_process" />
<theme idref="A3" />
<clue>These results indicate that the BCL-6 protein can function as a sequence-specific transcriptional repressor and have implications for the role of BCL6 in normal lymphoid <clueType>development</clueType> and lymphomagenesis.</clue>
</event>
<event uncertainty="probable" id="E10">
<type class="Positive_regulation" />
<theme idref="E9" />
<cause idref="T36" />
<clue>These results indicate that the BCL-6 protein can function as a sequence-specific transcriptional repressor and have implications for the <clueType>role</clueType> <linkCause>of</linkCause> BCL6 <linkTheme>in</linkTheme> normal lymphoid development and lymphomagenesis.</clue>
</event>
<event uncertainty="probable" id="E11">
<type class="Positive_regulation" />
<theme idref="E9" />
<cause idref="T38" />
<clue>These results indicate that the BCL-6 protein can function as a sequence-specific transcriptional repressor and have implications for the <clueType>role</clueType> <linkCause>of</linkCause> BCL6 <linkTheme>in</linkTheme> normal lymphoid development and lymphomagenesis.</clue>
</event>
<event id="E12">
<type class="Negative_regulation" />
<cause idref="T33" />
<clue>These results indicate that the BCL-6 protein can <clueType>function as</clueType> a sequence-specific <clueType>transcriptional repressor</clueType> and have implications for the role of BCL6 in normal lymphoid development and lymphomagenesis.</clue>
</event>
</AbstractText>
</Abstract>
</Article>
</MedlineCitation>
</PubmedArticle>
</PubmedArticleSet>
</Annotation>
