<?xml version="1.0" encoding="utf-8"?>
<!DOCTYPE Annotation PUBLIC "-//GENIA//DTD GENIA ANNOTATION EVENT 2.0//EN" "../GENIAtypes/GENIA_event_20.dtd">
<Annotation created="13/11/2006" annotates="http://www.ncbi.nlm.nih.gov/entrez/eutils/efetch.fcgi?db=pubmed&amp;retmode=xml&amp;rettype=medline&amp;id=1531412" creator="Noriko Katsu">
<PubmedArticleSet>
<PubmedArticle>
<MedlineCitation>
<PMID>1531412</PMID>
<Article>
<ArticleTitle>
<sentence id="S1"><term sem="Other" id="T1" lex="transcriptional_regulation">Transcriptional regulation</term> during <term sem="Other" id="T2" lex="T-cell_development"><term sem="Cell_natural" id="T3" lex="T-cell">T-cell</term> development</term>: the <term sem="DNA_domain_or_region" id="T4" lex="alpha_TCR_gene">alpha TCR gene</term> as a <term sem="Other" id="T5" lex="molecular_model">molecular model</term>.</sentence>
<event id="E1">
<type class="Regulation" />
<theme idref="E4" />
<clue>Transcriptional <clueType>regulation</clueType> during T-cell development: the alpha TCR gene as a molecular model.</clue>
</event>
<event id="E2">
<type class="Correlation" />
<theme idref="E1" />
<theme idref="E3" />
<clue>Transcriptional regulation <linkTheme>during</linkTheme> T-cell development: the alpha TCR gene as a molecular model.</clue>
</event>
<event id="E3">
<type class="Cell_differentiation" />
<theme idref="T3" />
<clue>Transcriptional regulation during T-cell <clueType>development</clueType>: the alpha TCR gene as a molecular model.</clue>
</event>
<event id="E4">
<type class="Transcription" />
<theme idref="T4" />
<clue><clueType>Transcriptional</clueType> regulation during T-cell development: the alpha TCR gene as a molecular model.</clue>
<comment>CAUTION: THEME from the context</comment>
</event>
</ArticleTitle>
<Abstract>
<AbstractText>
<sentence id="S2">The regulation of <term sem="Other" id="T6" lex="gene_expression">gene expression</term> during <term sem="Other" id="T7" lex="lymphocyte_differentiation"><term sem="Cell_natural" id="T8" lex="lymphocyte">lymphocyte</term> differentiation</term> is a complex process involving interactions between <cons sem="(AND DNA_domain_or_region DNA_domain_or_region)" id="T9" lex="(AND multiple_positive_transcriptional_regulatory_element multiple_negative_transcriptional_regulatory_element)"><frag id="F1">multiple</frag> <frag id="F2">positive</frag> and <frag id="F3">negative</frag> <frag id="F4">transcriptional regulatory elements</frag></cons>.</sentence>
<event id="E6">
<type class="Regulation" />
<theme idref="T6" />
<cause idref="E10" />
<clue>The <clueType>regulation</clueType> <linkTheme>of</linkTheme> gene expression <clueTime>during lymphocyte differentiation</clueTime> is a complex process <linkCause>involving</linkCause> interactions between multiple positive and negative transcriptional regulatory elements.</clue>
</event>
<event id="E8">
<type class="Cell_differentiation" />
<theme idref="T8" />
<clue>The regulation of gene expression during lymphocyte <clueType>differentiation</clueType> is a complex process involving interactions between multiple positive and negative transcriptional regulatory elements.</clue>
</event>
<event id="E9">
<type class="Regulation" />
<theme idref="E6" />
<cause idref="E10" />
<clue>The regulation of gene expression during lymphocyte differentiation is a complex process <clueType>involving</clueType> interactions between multiple positive and negative transcriptional regulatory elements.</clue>
</event>
<event id="E10">
<type class="Correlation" />
<theme idref1="F4" idref="F2" />
<theme idref1="F4" idref="F3" />
<clue>The regulation of gene expression during lymphocyte differentiation is a complex process involving <clueType>interactions</clueType> <linkTheme>between</linkTheme> multiple positive and negative transcriptional regulatory elements.</clue>
</event>
<sentence id="S3">In this article, <term sem="Other" id="T10" lex="transcriptional_regulation">transcriptional regulation</term> of the <term sem="DNA_domain_or_region" id="T11" lex="archetypal_T-cell-specific_gene">archetypal <term sem="Cell_natural" id="T12" lex="T-cell">T-cell</term>-specific gene</term>, <term sem="DNA_domain_or_region" id="T13" lex="alpha_TCR">alpha TCR</term>, is discussed.</sentence>
<event id="E13">
<type class="Regulation" />
<theme idref="T13" />
<clue>In this article, <clueType>transcriptional regulation</clueType> <linkTheme>of</linkTheme> the archetypal T-cell-specific gene, alpha TCR, is discussed.</clue>
</event>
<sentence id="S4">Major recent developments, including the identification of novel families of <term sem="Protein_family_or_group" id="T14" lex="transcription_factor">transcription factors</term> that regulate multiple <term sem="DNA_family_or_group" id="T15" lex="T-cell_gene"><term sem="Cell_natural" id="T16" lex="T-cell">T-cell</term> genes</term> during <term sem="Other" id="T17" lex="thymocyte_ontogeny">thymocyte ontogeny</term> and <term sem="Other" id="T18" lex="T-cell_activation"><term sem="Cell_natural" id="T19" lex="T-cell">T-cell</term> activation</term>, are described.</sentence>
<event id="E15">
<type class="Regulation" />
<theme idref="T15" />
<cause idref="T14" />
<clue>Major recent developments, including the identification of novel families of transcription factors that <clueType>regulate</clueType> multiple <clueLoc>T-cell</clueLoc> genes during thymocyte ontogeny and T-cell activation, are described.</clue>
<comment>NER: T14 sem mod, DNA_domain_or_region -&gt; Protein_family_or_group</comment>
</event>
<event id="E16">
<type class="Correlation" />
<theme idref="E15" />
<theme idref="T17" />
<clue>Major recent developments, including the identification of novel families of transcription factors that regulate multiple T-cell genes <linkTheme>during</linkTheme> thymocyte ontogeny and T-cell activation, are described.</clue>
</event>
<event id="E17">
<type class="Correlation" />
<theme idref="E15" />
<theme idref="E18" />
<clue>Major recent developments, including the identification of novel families of transcription factors that regulate multiple T-cell genes <linkTheme>during</linkTheme> thymocyte ontogeny and T-cell activation, are described.</clue>
</event>
<event id="E18">
<type class="Physiological_process" />
<theme idref="T19" />
<clue>Major recent developments, including the identification of novel families of transcription factors that regulate multiple T-cell genes during thymocyte ontogeny and T-cell <clueType>activation</clueType>, are described.</clue>
</event>
</AbstractText>
</Abstract>
</Article>
</MedlineCitation>
</PubmedArticle>
</PubmedArticleSet>
</Annotation>
