<?xml version="1.0" encoding="utf-8"?>
<!DOCTYPE Annotation PUBLIC "-//GENIA//DTD GENIA ANNOTATION EVENT 2.0//EN" "../GENIAtypes/GENIA_event_20.dtd">
<Annotation created="02/05/2006" creator="Junko Matsuura" annotates="http://www.ncbi.nlm.nih.gov/entrez/eutils/efetch.fcgi?db=pubmed&amp;retmode=xml&amp;rettype=medline&amp;id=8184011">
<PubmedArticleSet>
<PubmedArticle>
<MedlineCitation>
<PMID>8184011</PMID>
<Article>
<ArticleTitle>
<sentence id="S1">Activation of <term sem="Protein_molecule" id="T1" lex="nuclear_factor_kappa_B">nuclear factor kappa B</term> in <term sem="Cell_natural" id="T2" lex="human_lymphoblastoid_cell">human lymphoblastoid cells</term> by <term sem="Other" id="T3" lex="low-dose_ionizing_radiation">low-dose ionizing radiation</term>.</sentence>
<event id="E1">
<type class="Positive_regulation" />
<theme idref="T1" />
<cause idref="T3" />
<clue><clueType>Activation</clueType> <linkTheme>of</linkTheme> nuclear factor kappa B <clueLoc>in human lymphoblastoid cells</clueLoc> <linkCause>by</linkCause> low-dose ionizing radiation.</clue>
</event>
</ArticleTitle>
<Abstract>
<AbstractText>
<sentence id="S2"><term sem="Protein_molecule" id="T4" lex="nuclear_factor_kappa_B">Nuclear factor kappa B</term> (<term sem="Protein_molecule" id="T5" lex="NF-kappa_B">NF-kappa B</term>) is a <term sem="Protein_family_or_group" id="T6" lex="pleiotropic_transcription_factor">pleiotropic transcription factor</term> which is involved in the <term sem="Other" id="T7" lex="transcriptional_regulation">transcriptional regulation</term> of several specific genes.</sentence>
<event id="E3">
<type class="Correlation" />
<theme idref="T7" />
<theme idref="T5" />
<clue>Nuclear factor kappa B (NF-kappa B) is a pleiotropic transcription factor which is <clueType>involved</clueType> <linkTheme>in</linkTheme> the transcriptional regulation of several specific genes.</clue>
</event>
<sentence id="S3">Recent reports demonstrated that <term sem="Other" id="T8" lex="ionizing_radiation">ionizing radiation</term> in the dose range of <term sem="Other" id="T9" lex="2-50_Gy">2-50 Gy</term> results in expression of <term sem="Protein_molecule" id="T10" lex="NF-kappa_B">NF-kappa B</term> in <term sem="Cell_cultured" id="T11" lex="human_KG-1_myeloid_leukemia_cell">human KG-1 myeloid leukemia cells</term> and <term sem="Cell_natural" id="T12" lex="human_B-lymphocyte_precursor_cell">human B-lymphocyte precursor cells</term>; the precise mechanism involved and the significance are not yet known.</sentence>
<event id="E4">
<type class="Gene_expression" />
<theme idref="T10" />
<clue>Recent reports demonstrated that ionizing radiation in the dose range of 2-50 Gy results in <clueType>expression</clueType> <linkTheme>of</linkTheme> NF-kappa B in human KG-1 myeloid leukemia cells and human B-lymphocyte precursor cells; the precise mechanism involved and the significance are not yet known.</clue>
</event>
<event id="E300">
<type class="Positive_regulation" />
<theme idref="E4" />
<cause idref="T8" />
<clue>Recent reports demonstrated that ionizing radiation in the dose range of 2-50 Gy <clueType>results</clueType> <linkTheme>in</linkTheme> expression of NF-kappa B <clueLoc>in human KG-1 myeloid leukemia cells</clueLoc> and human B-lymphocyte precursor cells; the precise mechanism involved and the significance are not yet known.</clue>
</event>
<event id="E301">
<type class="Positive_regulation" />
<theme idref="E4" />
<cause idref="T8" />
<clue>Recent reports demonstrated that ionizing radiation in the dose range of 2-50 Gy <clueType>results</clueType> <linkTheme>in</linkTheme> expression of NF-kappa B <clueLoc>in</clueLoc> human KG-1 myeloid leukemia cells and <clueLoc>human B-lymphocyte precursor cells</clueLoc>; the precise mechanism involved and the significance are not yet known.</clue>
</event>
<sentence id="S4">The present report demonstrates that even lower doses of <term sem="Other" id="T13" lex="ionizing_radiation">ionizing radiation</term>, <term sem="Other" id="T14" lex="0.25-2.0_Gy">0.25-2.0 Gy</term>, are capable of inducing expression of <term sem="Protein_molecule" id="T15" lex="NF-kappa_B">NF-kappa B</term> in <term sem="Cell_cultured" id="T16" lex="EBV-transformed_244B_human_lymphoblastoid_cell">EBV-transformed 244B <term sem="Cell_natural" id="T17" lex="human_lymphoblastoid_cell">human lymphoblastoid cells</term></term>.</sentence>
<event id="E6">
<type class="Gene_expression" />
<theme idref="T15" />
<clue>The present report demonstrates that even lower doses of ionizing radiation, 0.25-2.0 Gy, are capable of inducing <clueType>expression</clueType> <linkTheme>of</linkTheme> NF-kappa B in EBV-transformed 244B human lymphoblastoid cells.</clue>
</event>
<event id="E7">
<type class="Positive_regulation" />
<theme idref="E6" />
<cause idref="T13" />
<clue>The present report demonstrates that even lower doses of ionizing radiation, 0.25-2.0 Gy, are capable of <clueType>inducing</clueType> expression of NF-kappa B <clueLoc>in EBV-transformed 244B human lymphoblastoid cells</clueLoc>.</clue>
</event>
<sentence id="S5">These results are in a dose range where the viability of the cells remains very high.</sentence>
<sentence id="S6">After exposure to <term sem="Other" id="T18" lex="137Cs_gamma_ray">137Cs gamma rays</term> at a dose rate of <term sem="Other" id="T19" lex="1.17_Gy/min">1.17 Gy/min</term>, a maximum in expression of <term sem="Protein_molecule" id="T20" lex="NF-kappa_B">NF-kappa B</term> was seen at 8 h after a <term sem="Other" id="T21" lex="0.5-Gy_exposure">0.5-Gy exposure</term>.</sentence>
<event id="E9">
<type class="Gene_expression" />
<theme idref="T20" />
<clue>After exposure to 137Cs gamma rays at a dose rate of 1.17 Gy/min, a maximum in <clueType>expression</clueType> <linkTheme>of</linkTheme> NF-kappa B was seen at 8 h after a 0.5-Gy exposure.</clue>
</event>
<event id="E10">
<type class="Positive_regulation" />
<theme idref="E9" />
<cause idref="T18" />
<clue><linkCause>After</linkCause> exposure to 137Cs gamma rays at a dose rate of 1.17 Gy/min, a maximum in expression of NF-kappa B was <clueType>seen</clueType> <clueTime>at 8 h after a 0.5-Gy exposure</clueTime>.</clue>
</event>
<sentence id="S7">Time-course studies revealed a <term sem="Other" id="A2">biphasic time-dependent expression</term> after <term sem="Other" id="T22" lex="0.5-,_1-_and_2-Gy_exposure">0.5-, 1- and 2-Gy exposures</term>.</sentence>
<event id="E11">
<type class="Positive_regulation" />
<theme idref="A2" />
<cause idref="T22" />
<clue><clueExperiment>Time-course studies</clueExperiment> <clueType>revealed</clueType> a biphasic time-dependent expression <clueTime>after</clueTime> 0.5-, 1- and 2-Gy exposures.</clue>
</event>
<sentence id="S8">However, for each time examined, the expression of <term sem="Protein_molecule" id="T23" lex="NF-kappa_B">NF-kappa B</term> was maximum after the <term sem="Other" id="T24" lex="0.5-Gy_exposure">0.5-Gy exposure</term>.</sentence>
<event id="E12">
<type class="Gene_expression" />
<theme idref="T23" />
<clue>However, for each time examined, the <clueType>expression</clueType> <linkTheme>of</linkTheme> NF-kappa B was maximum after the 0.5-Gy exposure.</clue>
</event>
<event id="E13">
<type class="Positive_regulation" />
<theme idref="E12" />
<cause idref="T24" />
<clue>However, for each time examined, the expression of NF-kappa B <clueType>was maximum</clueType> <linkCause>after</linkCause> the 0.5-Gy exposure.</clue>
</event>
<sentence id="S9">The expression of the <cons sem="(AND Protein_molecule Protein_molecule)" id="T25" lex="(AND p50_NF-kappa_B_subunit p65_NF-kappa_B_subunit)"><frag id="F1"><term sem="Protein_molecule" id="A20">p50</term></frag> and <frag id="F2"><term sem="Protein_molecule" id="A21">p65</term></frag> <frag id="F3">NF-kappa B subunits</frag></cons> was also shown to be regulated differentially after exposures to <term sem="Other" id="T26" lex="1.0_and_2.0_Gy">1.0 and 2.0 Gy</term>.</sentence>
<event id="E14">
<type class="Gene_expression" />
<theme idref="A20" />
<clue>The <clueType>expression</clueType> of the p50 and p65 NF-kappa B subunits was also shown to be regulated differentially after exposures to 1.0 and 2.0 Gy.</clue>
</event>
<event id="E15">
<type class="Gene_expression" />
<theme idref="A21" />
<clue>The <clueType>expression</clueType> of the p50 and p65 NF-kappa B subunits was also shown to be regulated differentially after exposures to 1.0 and 2.0 Gy.</clue>
</event>
<event id="E16">
<type class="Regulation" />
<theme idref="E14" />
<cause idref="T26" />
<clue>The expression of the p50 and p65 NF-kappa B subunits was also shown to be <clueType>regulated</clueType> differentially <linkCause>after</linkCause> exposures to 1.0 and 2.0 Gy.</clue>
</event>
<event id="E17">
<type class="Regulation" />
<theme idref="E15" />
<cause idref="T26" />
<clue>The expression of the p50 and p65 NF-kappa B subunits was also shown to be <clueType>regulated</clueType> differentially <linkCause>after</linkCause> exposures to 1.0 and 2.0 Gy.</clue>
</event>
</AbstractText>
</Abstract>
</Article>
</MedlineCitation>
</PubmedArticle>
</PubmedArticleSet>
</Annotation>
