<?xml version="1.0" encoding="utf-8"?>
<!DOCTYPE Annotation PUBLIC "-//GENIA//DTD GENIA ANNOTATION EVENT 2.0//EN" "../GENIAtypes/GENIA_event_20.dtd">
<Annotation created="14/03/2007" annotates="http://www.ncbi.nlm.nih.gov/entrez/eutils/efetch.fcgi?db=pubmed&amp;retmode=xml&amp;rettype=medline&amp;id=1700011" creator="Junko Matsuura">
<PubmedArticleSet>
<PubmedArticle>
<MedlineCitation>
<PMID>1700011</PMID>
<Article>
<ArticleTitle>
<sentence id="S1"><term sem="Protein_molecule" id="T1" lex="NF-X2">NF-X2</term> that binds to the <term sem="DNA_domain_or_region" id="T2" lex="DRA_X2-box">DRA X2-box</term> is <term sem="Protein_molecule" id="T3" lex="activator_protein_1">activator protein 1</term>.</sentence>
<event id="E1">
<type class="Binding" />
<theme idref="T1" />
<theme idref="T2" />
<clue>NF-X2 that <clueType>binds</clueType> <linkTheme>to</linkTheme> the DRA X2-box is activator protein 1.</clue>
</event>
<event id="E2">
<type class="Binding" />
<theme idref="T3" />
<theme idref="T2" />
<clue>NF-X2 that <clueType>binds</clueType> <linkTheme>to</linkTheme> the DRA X2-box is activator protein 1.</clue>
</event>
<sentence id="S2"><term sem="Other" id="T4" lex="expression_cloning">Expression cloning</term> of <term sem="Protein_molecule" id="T5" lex="c-Jun">c-Jun</term>.</sentence>
</ArticleTitle>
<Abstract>
<AbstractText>
<sentence id="S3"><term sem="Protein_family_or_group" id="T6" lex="human_class_II_MHC_Ag">Human class II MHC Ag</term> are a family of <term sem="Protein_domain_or_region" id="T7" lex="cell_surface_glycoprotein">cell surface glycoproteins</term>.</sentence>
<sentence id="S4">Their constitutive expression is limited to <term sem="Cell_natural" id="T8" lex="B_lymphocyte">B lymphocytes</term> and <term sem="Cell_natural" id="T9" lex="thymic_epithelial_cell">thymic epithelial cells</term>.</sentence>
<event id="E300">
<type class="Gene_expression" />
<theme idref="T6" />
<clue><corefTheme>Their</corefTheme> constitutive <clueType>expression</clueType> is limited to <clueLoc>B lymphocytes</clueLoc> and thymic epithelial cells.</clue>
</event>
<event id="E301">
<type class="Gene_expression" />
<theme idref="T6" />
<clue><corefTheme>Their</corefTheme> constitutive <clueType>expression</clueType> is limited to B lymphocytes and <clueLoc>thymic epithelial cells</clueLoc>.</clue>
</event>
<sentence id="S5">In many other cells their <term sem="Other" id="T10" lex="expression">expression</term> can be induced by <term sem="Protein_molecule" id="T11" lex="IFN-gamma">IFN-gamma</term>.</sentence>
<event id="E4">
<type class="Gene_expression" />
<theme idref="T6" />
<clue>In many other cells <corefTheme>their</corefTheme> <clueType>expression</clueType> can be induced by IFN-gamma.</clue>
</event>
<event id="E5">
<type class="Positive_regulation" />
<theme idref="E4" />
<cause idref="T11" />
<clue><clueLoc>In many other cells</clueLoc> their expression can be <clueType>induced</clueType> <linkCause>by</linkCause> IFN-gamma.</clue>
</event>
<sentence id="S6"><term sem="DNA_domain_or_region" id="A1">Conserved upstream promoter sequences</term> regulate this tissue-specific expression of <term sem="DNA_family_or_group" id="T12" lex="class_II_gene">class II genes</term>.</sentence>
<event id="E302">
<type class="Regulation" />
<theme idref="E300" />
<cause idref="A1" />
<clue>Conserved upstream promoter sequences <clueType>regulate</clueType> <corefTheme>this tissue-specific expression of class II genes.</corefTheme></clue>
</event>
<event id="E303">
<type class="Regulation" />
<theme idref="E301" />
<cause idref="A1" />
<clue>Conserved upstream promoter sequences <clueType>regulate</clueType> <corefTheme>this tissue-specific expression of class II genes.</corefTheme></clue>
</event>
<event id="E7">
<type class="Regulation" />
<theme idref="E5" />
<cause idref="A1" />
<clue>Conserved upstream promoter sequences <clueType>regulate</clueType> <corefTheme>this tissue-specific expression of class II genes.</corefTheme></clue>
</event>
<sentence id="S7">In the <term sem="DNA_domain_or_region" id="T13" lex="DRA_promoter">DRA promoter</term>, one of these <term sem="DNA_domain_or_region" id="T14" lex="cis-acting_regulatory_motif">cis-acting regulatory motifs</term> is the <term sem="DNA_domain_or_region" id="T15" lex="X2-box">X2-box</term> to which <term sem="Protein_molecule" id="T16" lex="nuclear_factor_X2">nuclear factor X2</term> (<term sem="Protein_molecule" id="T17" lex="NF-X2">NF-X2</term>) binds.</sentence>
<event id="E8">
<type class="Binding" />
<theme idref="T17" />
<theme idref="T15" />
<clue>In the DRA promoter, one of these cis-acting regulatory motifs is the X2-box <linkTheme>to</linkTheme> which nuclear factor X2 (NF-X2) <clueType>binds</clueType>.</clue>
</event>
<sentence id="S8">Here, we present the isolation and characterization of the <term sem="DNA_family_or_group" id="T18" lex="full-length_cDNA_clone">full-length cDNA clone</term> encoding <term sem="Protein_molecule" id="T19" lex="NF-X2">NF-X2</term>.</sentence>
<sentence id="S9">This <term sem="DNA_molecule" id="T20" lex="cDNA_clone">cDNA clone</term> was isolated by <term sem="Other" id="T21" lex="expression_cDNA_cloning">expression <term sem="DNA_family_or_group" id="T22" lex="cDNA">cDNA</term> cloning</term>, and encodes the <term sem="Protein_molecule" id="T23" lex="human_c-Jun_protein">human <term sem="Protein_molecule" id="T24" lex="c-Jun">c-Jun</term> protein</term>, which together with <term sem="Protein_molecule" id="T25" lex="c-Fos">c-Fos</term> forms the <term sem="Protein_family_or_group" id="T26" lex="heterodimeric_activator_protein-1_transcription_complex">heterodimeric activator protein-1 transcription complex</term>.</sentence>
<event id="E9">
<type class="Binding" />
<theme idref="T25" />
<theme idref="T24" />
<clue>This cDNA clone was isolated by expression cDNA cloning, and encodes the human c-Jun protein, which <linkTheme>together with</linkTheme> c-Fos <clueType>forms the heterodimeric</clueType> activator protein-1 transcription <clueType>complex</clueType>.</clue>
</event>
<event id="E19">
<type class="Protein_metabolism" />
<theme idref="T26" />
<clue>This cDNA clone was isolated by expression cDNA cloning, and encodes the human c-Jun protein, which together with c-Fos <clueType>forms the heterodimeric</clueType> activator protein-1 transcription <clueType>complex</clueType>.</clue>
</event>
<sentence id="S10">Whereas <term sem="Protein_complex" id="T27" lex="c-Fos/c-Jun_heterodimer"><term sem="Protein_molecule" id="T28" lex="c-Fos">c-Fos</term><term sem="Protein_molecule" id="T29" lex="c-Jun">/c-Jun</term> heterodimers</term> do not exist in <term sem="Cell_cultured" id="T30" lex="B_cell">B cells</term>, they form and bind to the <term sem="DNA_domain_or_region" id="T31" lex="X2-box">X2-box</term> in <term sem="Cell_cultured" id="T32" lex="class_II_nonexpressing_cell">class II nonexpressing cells</term>.</sentence>
<event assertion="non-exist" id="E10">
<type class="Gene_expression" />
<theme idref="T27" />
<clue>Whereas c-Fos/c-Jun heterodimers do not <clueType>exist</clueType> <clueLoc>in B cells</clueLoc>, they form and bind to the X2-box in class II nonexpressing cells.</clue>
</event>
<event id="E11">
<type class="Binding" />
<theme idref="T28" />
<theme idref="T29" />
<clue>Whereas c-Fos/c-Jun <clueType>heterodimers</clueType> do not exist in B cells, they <clueType>form</clueType> and bind to the X2-box <clueLoc>in class II nonexpressing cells</clueLoc>.</clue>
</event>
<event id="E12">
<type class="Binding" />
<theme idref="T27" />
<theme idref="T31" />
<clue>Whereas c-Fos/c-Jun heterodimers do not exist in B cells, they form and <clueType>bind</clueType> <linkTheme>to</linkTheme> the X2-box <clueLoc>in class II nonexpressing cells</clueLoc>.</clue>
</event>
<sentence id="S11">Thus, <term sem="Protein_complex" id="T33" lex="c-Fos/c-Jun_heterodimer"><term sem="Protein_molecule" id="T34" lex="c-Fos">c-Fos</term><term sem="Protein_molecule" id="T35" lex="c-Jun">/c-Jun</term> heterodimers</term> might contribute to the repression of <term sem="Other" id="T36" lex="DRA_gene_expression"><term sem="DNA_domain_or_region" id="T37" lex="DRA_gene">DRA gene</term> expression</term>.</sentence>
<event id="E13">
<type class="Gene_expression" />
<theme idref="T37" />
<clue>Thus, c-Fos/c-Jun heterodimers might contribute to the repression of DRA gene <clueType>expression</clueType>.</clue>
</event>
<event uncertainty="probable" id="E14">
<type class="Negative_regulation" />
<theme idref="E13" />
<cause idref="T33" />
<clue>Thus, c-Fos/c-Jun heterodimers might contribute to the <clueType>repression</clueType> <linkTheme>of</linkTheme> DRA gene expression.</clue>
</event>
</AbstractText>
</Abstract>
</Article>
</MedlineCitation>
</PubmedArticle>
</PubmedArticleSet>
</Annotation>
